{"ar6_text_check":{"all_found_in_pdf_page":true,"values_checked":57},"baseline_conversion":{"known_value_checks":[{"actual":1.4802973661668754e-17,"expected":0.0,"name":"gistemp_glb rebased to 1951-1980: every calendar-month mean over 1951-1980 is 0","pass":true,"tol":1e-09},{"actual":2.294460917558657e-16,"expected":0.0,"name":"gistemp_glb rebased to 1991-2020: every calendar-month mean over 1991-2020 is 0","pass":true,"tol":1e-09},{"actual":1.0884539457109377e-16,"expected":0.0,"name":"hadcrut5_glb rebased to 1850-1900: every calendar-month mean over 1850-1900 is 0","pass":true,"tol":1e-09},{"actual":1.3322676295501878e-16,"expected":0.0,"name":"hadcrut5_glb rebased to 1991-2020: every calendar-month mean over 1991-2020 is 0","pass":true,"tol":1e-09},{"actual":4.440892098500626e-16,"expected":0.0,"name":"GISTEMP 1951-1980 -> 1991-2020 equals direct rebase (max abs diff, degC)","pass":true,"tol":1e-09},{"actual":0.005833333333333357,"expected":0.0,"name":"GISTEMP annual mean of 12 months vs published J-D column (max abs diff, rounding only)","pass":true,"tol":0.011},{"actual":4.0833333270207106e-08,"expected":0.0,"name":"HadCRUT5 annual file vs mean of its 12 monthly values (max abs diff, degC)","pass":true,"tol":0.0015}]},"grid_encoding":{"gistemp":{"clipped_cells":0,"max_abs_error_c":0.05,"mean_abs_error_c":0.02492,"roundtrip_ok":true},"hadcrut5":{"clipped_cells":0,"max_abs_error_c":0.05,"mean_abs_error_c":0.02503,"roundtrip_ok":true}},"grid_vs_official_global":{"gistemp":{"baseline":"1951-1980 (native)","corr":0.99969,"max_abs_diff":0.0428,"mean_diff":-0.0001,"n_years":146,"rmsd":0.0106},"hadcrut5":{"baseline":"1961-1990 (native)","corr":0.99963,"max_abs_diff":0.0421,"mean_diff":0.0006,"n_years":176,"rmsd":0.0112},"note":"Cos(lat)-weighted mean of the OBSERVED grid cells vs the source's own published global mean. They differ because the publishers weight, infill and handle coverage differently and because early HadCRUT5 coverage is incomplete. Reported, not hidden: the site uses the published series for headline numbers, not the grid mean."},"internal_consistency":[{"detail":"28528200 = 25428862 + 3099338","name":"gistemp: total cells = valid + missing","pass":true},{"detail":"2365200 = 2086434 + 278766","name":"gistemp: annual cell-years = valid + dropped","pass":true},{"detail":"5495040 = 4395277 + 1099763","name":"hadcrut5: total cells = valid + missing","pass":true},{"detail":"456192 = 351641 + 104551","name":"hadcrut5: annual cell-years = valid + dropped","pass":true},{"detail":"len(years)=176","name":"series_annual: every values array has len(years)","pass":true},{"detail":"n=2121","name":"series_monthly: every values array has n_months","pass":true},{"detail":"GISTEMP starts 1880","name":"GISTEMP never gets a 1850-1900 baseline","pass":true},{"detail":"858072","name":"all grid binaries (anomaly, intro, trend) within 1.5 MB gzip total","pass":true},{"detail":"clipped_cells == 0","name":"no value outside +/-12.7 C was clipped in grid encoding","pass":true}],"schema_version":"v1","tags":{"ar6_text_check":"DERIVED","baseline_conversion":"DERIVED","grid_encoding":"DERIVED","grid_vs_official_global":"DERIVED","internal_consistency":"DERIVED","trend_ci_simulation":"SIMULATED"},"trend_ci_simulation":{"coverage_ar1":0.932,"coverage_hac":0.828,"coverage_naive":0.728,"n_sims":2000,"n_years":50,"note":"SYNTHETIC-NOISE method check, not data: AR(1) noise (phi 0.5, innovation sd 0.1 C) plus a known linear trend, 50 years, 95% intervals. Shows how often each interval covers the true slope. Naive OLS undercovers; the AR(1)-adjusted interval (primary) is close to nominal; HAC is in between at this short length.","phi":0.5,"tag":"SIMULATED","true_slope_per_decade":0.2}}
